{"$schema":"https://json-schema.org/draft/2020-12/schema","type":"object","required":["project_id","sources","claims","instruction_filter"],"properties":{"project_id":{"type":"string"},"sources":{"type":"array"},"claims":{"type":"array"},"instruction_filter":{"type":"object","required":["judged","dropped","rules","dropped_claims"],"properties":{"judged":{"type":"integer","minimum":0},"dropped":{"type":"integer","minimum":0},"rules":{"type":"array","items":{"type":"string"}},"dropped_claims":{"type":"array","items":{"type":"object","required":["source_id","rule_id","reason","chars","snippet"],"properties":{"source_id":{"type":"string"},"url":{"type":"string"},"rule_id":{"type":"string"},"reason":{"type":"string"},"chars":{"type":"integer","minimum":0},"snippet":{"type":"string"}},"additionalProperties":false}}},"additionalProperties":false}},"additionalProperties":false}