{
  "project_id": "skill-explainer",
  "sources": [
    {
      "id": "src-77ae700ce1",
      "url": "https://www.anthropic.com/engineering/equipping-agents-for-the-real-world-with-agent-skills",
      "title": "Equipping agents for the real world with Agent Skills \\ Anthropic",
      "content_hash": "0318f00d80a63ec7f4ca49fdcf88c039a3715d76be1a699fa07029966e0c1e05"
    },
    {
      "id": "src-bbd9e46f13",
      "url": "https://code.claude.com/docs/en/skills",
      "title": "Extend Claude with skills - Claude Code Docs",
      "content_hash": "4abb3cb99438a18717e381d7555c3dc32ffa57afc2e9f5c8743dc4a1ffc7445b"
    },
    {
      "id": "src-47e636d803",
      "url": "https://agentskills.io/",
      "title": "Agent Skills Overview - Agent Skills",
      "content_hash": "26c3ff8e984fe2c8f2c4b19f6d5a76a677fc4c0f3b8e67dd12078aa8c45f10ab"
    },
    {
      "id": "src-bfa87fb31b",
      "url": "https://www.anthropic.com/news/skills",
      "title": "Introducing Agent Skills | Claude by Anthropic",
      "content_hash": "cb0ed9a6f568972bb14198d88ed0d3d0a6a2f53bfd2824444689acd14b1a88b2"
    }
  ],
  "claims": [
    {
      "id": "claim-001",
      "statement": "Equipping agents for the real world with Agent Skills \\ Anthropic Skip to main content Skip to footer Research Policy Commitments Learn News Try Claude Engineering at Anthropic Equipping agents for the real world with Agent Skills Published Oct 16, 2025 Claude is powerful, but real work requires procedural knowledge and organizational context.",
      "source_ids": [
        "src-77ae700ce1"
      ],
      "evidence": [
        {
          "source_id": "src-77ae700ce1",
          "url": "https://www.anthropic.com/engineering/equipping-agents-for-the-real-world-with-agent-skills",
          "excerpt": "Equipping agents for the real world with Agent Skills \\ Anthropic Skip to main content Skip to footer Research Policy Commitments Learn News Try Claude Engineering at Anthropic Equipping agents for the real world with Agent Skills Published Oct 16, 2025 Claude is powerful, but real work requires procedural knowledge and organizational context."
        }
      ]
    },
    {
      "id": "claim-002",
      "statement": "Introducing Agent Skills, a new way to build specialized agents using files and folders.",
      "source_ids": [
        "src-77ae700ce1"
      ],
      "evidence": [
        {
          "source_id": "src-77ae700ce1",
          "url": "https://www.anthropic.com/engineering/equipping-agents-for-the-real-world-with-agent-skills",
          "excerpt": "Introducing Agent Skills, a new way to build specialized agents using files and folders."
        }
      ]
    },
    {
      "id": "claim-003",
      "statement": "Update: We&#x27;ve published Agent Skills as an open standard for cross-platform portability.",
      "source_ids": [
        "src-77ae700ce1"
      ],
      "evidence": [
        {
          "source_id": "src-77ae700ce1",
          "url": "https://www.anthropic.com/engineering/equipping-agents-for-the-real-world-with-agent-skills",
          "excerpt": "Update: We&#x27;ve published Agent Skills as an open standard for cross-platform portability."
        }
      ]
    },
    {
      "id": "claim-004",
      "statement": "(December 18, 2025) As model capabilities improve, we can now build general-purpose agents that interact with full-fledged computing environments.",
      "source_ids": [
        "src-77ae700ce1"
      ],
      "evidence": [
        {
          "source_id": "src-77ae700ce1",
          "url": "https://www.anthropic.com/engineering/equipping-agents-for-the-real-world-with-agent-skills",
          "excerpt": "(December 18, 2025) As model capabilities improve, we can now build general-purpose agents that interact with full-fledged computing environments."
        }
      ]
    },
    {
      "id": "claim-005",
      "statement": "Claude Code , for example, can accomplish complex tasks across domains using local code execution and filesystems.",
      "source_ids": [
        "src-77ae700ce1"
      ],
      "evidence": [
        {
          "source_id": "src-77ae700ce1",
          "url": "https://www.anthropic.com/engineering/equipping-agents-for-the-real-world-with-agent-skills",
          "excerpt": "Claude Code , for example, can accomplish complex tasks across domains using local code execution and filesystems."
        }
      ]
    },
    {
      "id": "claim-006",
      "statement": "But as these agents become more powerful, we need more composable, scalable, and portable ways to equip them with domain-specific expertise.",
      "source_ids": [
        "src-77ae700ce1"
      ],
      "evidence": [
        {
          "source_id": "src-77ae700ce1",
          "url": "https://www.anthropic.com/engineering/equipping-agents-for-the-real-world-with-agent-skills",
          "excerpt": "But as these agents become more powerful, we need more composable, scalable, and portable ways to equip them with domain-specific expertise."
        }
      ]
    },
    {
      "id": "claim-007",
      "statement": "This led us to create Agent Skills : organized folders of instructions, scripts, and resources that agents can discover and load dynamically to perform better at specific tasks.",
      "source_ids": [
        "src-77ae700ce1"
      ],
      "evidence": [
        {
          "source_id": "src-77ae700ce1",
          "url": "https://www.anthropic.com/engineering/equipping-agents-for-the-real-world-with-agent-skills",
          "excerpt": "This led us to create Agent Skills : organized folders of instructions, scripts, and resources that agents can discover and load dynamically to perform better at specific tasks."
        }
      ]
    },
    {
      "id": "claim-008",
      "statement": "Skills extend Claude’s capabilities by packaging your expertise into composable resources for Claude, transforming general-purpose agents into specialized agents that fit your needs.",
      "source_ids": [
        "src-77ae700ce1"
      ],
      "evidence": [
        {
          "source_id": "src-77ae700ce1",
          "url": "https://www.anthropic.com/engineering/equipping-agents-for-the-real-world-with-agent-skills",
          "excerpt": "Skills extend Claude’s capabilities by packaging your expertise into composable resources for Claude, transforming general-purpose agents into specialized agents that fit your needs."
        }
      ]
    },
    {
      "id": "claim-009",
      "statement": "Building a skill for an agent is like putting together an onboarding guide for a new hire.",
      "source_ids": [
        "src-77ae700ce1"
      ],
      "evidence": [
        {
          "source_id": "src-77ae700ce1",
          "url": "https://www.anthropic.com/engineering/equipping-agents-for-the-real-world-with-agent-skills",
          "excerpt": "Building a skill for an agent is like putting together an onboarding guide for a new hire."
        }
      ]
    },
    {
      "id": "claim-010",
      "statement": "Instead of building fragmented, custom-designed agents for each use case, anyone can now specialize their agents with composable capabilities by capturing and sharing their procedural knowledge.",
      "source_ids": [
        "src-77ae700ce1"
      ],
      "evidence": [
        {
          "source_id": "src-77ae700ce1",
          "url": "https://www.anthropic.com/engineering/equipping-agents-for-the-real-world-with-agent-skills",
          "excerpt": "Instead of building fragmented, custom-designed agents for each use case, anyone can now specialize their agents with composable capabilities by capturing and sharing their procedural knowledge."
        }
      ]
    },
    {
      "id": "claim-011",
      "statement": "In this article, we explain what Skills are, show how they work, and share best practices for building your own.",
      "source_ids": [
        "src-77ae700ce1"
      ],
      "evidence": [
        {
          "source_id": "src-77ae700ce1",
          "url": "https://www.anthropic.com/engineering/equipping-agents-for-the-real-world-with-agent-skills",
          "excerpt": "In this article, we explain what Skills are, show how they work, and share best practices for building your own."
        }
      ]
    },
    {
      "id": "claim-012",
      "statement": "A skill is a directory containing a SKILL.md file that contains organized folders of instructions, scripts, and resources that give agents additional capabilities.",
      "source_ids": [
        "src-77ae700ce1"
      ],
      "evidence": [
        {
          "source_id": "src-77ae700ce1",
          "url": "https://www.anthropic.com/engineering/equipping-agents-for-the-real-world-with-agent-skills",
          "excerpt": "A skill is a directory containing a SKILL.md file that contains organized folders of instructions, scripts, and resources that give agents additional capabilities."
        }
      ]
    },
    {
      "id": "claim-013",
      "statement": "Extend Claude with skills - Claude Code Docs Documentation Index Fetch the complete documentation index at: /docs/llms.txt Use this file to discover all available pages before exploring further.",
      "source_ids": [
        "src-bbd9e46f13"
      ],
      "evidence": [
        {
          "source_id": "src-bbd9e46f13",
          "url": "https://code.claude.com/docs/en/skills",
          "excerpt": "Extend Claude with skills - Claude Code Docs Documentation Index Fetch the complete documentation index at: /docs/llms.txt Use this file to discover all available pages before exploring further."
        }
      ]
    },
    {
      "id": "claim-014",
      "statement": "Skip to main content Claude Code Docs home page English Search...",
      "source_ids": [
        "src-bbd9e46f13"
      ],
      "evidence": [
        {
          "source_id": "src-bbd9e46f13",
          "url": "https://code.claude.com/docs/en/skills",
          "excerpt": "Skip to main content Claude Code Docs home page English Search..."
        }